<?xml version="1.0" encoding="UTF-8"?>
<FlussoFattureTrasporto xmlns:xsi="http://www.w3.org/2001/XMLSchema-instance" xsi:noNamespaceSchemaLocation="FlussoFatture.xsd">
	<TestataFlusso>
		<TCodiceFlusso>FTR</TCodiceFlusso>
		<TCodiceTipoFattura>C</TCodiceTipoFattura>
		<TNumeroSequenza>1</TNumeroSequenza>
		<TDataEmissioneFattura>22/02/2016</TDataEmissioneFattura>
		<TDataScadenzaFattura>25/03/2016</TDataScadenzaFattura>
		<TRagioneSocialeMittente>DIS EE SpA</TRagioneSocialeMittente>
		<TPartitaIVAMittente>12345678901</TPartitaIVAMittente>
		<TIndirizzoMittente>Piazzale Trionfale, 23</TIndirizzoMittente>
		<TCAPMittente>00185</TCAPMittente>
		<TLocalitaMittente>Roma</TLocalitaMittente>
		<TProvinciaMittente>RM</TProvinciaMittente>
		<TNazioneMittente>IT</TNazioneMittente>
		<TIBANMittente>IT02L1234512345123456789012</TIBANMittente>
		<TRagioneSocialeDestinatario>VEN SPA</TRagioneSocialeDestinatario>
		<TPartitaIVADestinatario>10987654321</TPartitaIVADestinatario>
		<TIndirizzoDestinatario>Via Laurentina, 100</TIndirizzoDestinatario>
		<TCAPDestinatario>00123</TCAPDestinatario>
		<TLocalitaDestinatario>Roma</TLocalitaDestinatario>
		<TProvinciaDestinatario>RM</TProvinciaDestinatario>
		<TNazioneDestinatario>IT</TNazioneDestinatario>
		<TContrattoDispacciamento>DISP123</TContrattoDispacciamento>
	</TestataFlusso>
	<Fatture>
		<FNumeroFattura>2016/10</FNumeroFattura>
		<TestataFattura>
			<FPeriodoCompetenzaDa>01/2016</FPeriodoCompetenzaDa>
			<FPeriodoCompetenzaA>01/2016</FPeriodoCompetenzaA>
			<FTotaleImponibileFattura>533,61</FTotaleImponibileFattura>
			<FTotaleIVAFattura>117,39</FTotaleIVAFattura>
			<FTotaleFattura>651,00</FTotaleFattura>
		</TestataFattura>
		<RiepilogoFattura>
			<RiepilogoValori>
				<RTipologiaContrattuale>Lettera a)</RTipologiaContrattuale>
				<RNumeroPod>1</RNumeroPod>
				<RTotTarDistQtFissa>0,22</RTotTarDistQtFissa>
				<RTotTarDistQtPotenza>0,58</RTotTarDistQtPotenza>
				<RTotTarDistEnAttiva>37,23</RTotTarDistEnAttiva>
				<RTotTarDistEnReattiva>0,00</RTotTarDistEnReattiva>
				<RTotOnGenUltComQtFissa>0,00</RTotOnGenUltComQtFissa>
				<RTotOnGenUltComQtPotenza>0,01</RTotOnGenUltComQtPotenza>
				<RTotOnGenUltComEnAttiva>29,75</RTotOnGenUltComEnAttiva>
				<RTotaleQuotaFissa>0,22</RTotaleQuotaFissa>
				<RTotaleQuotaPotenza>0,59</RTotaleQuotaPotenza>
				<RTotaleEnergiaAttiva>66,98</RTotaleEnergiaAttiva>
				<RTotaleEnergiaReattiva>0,00</RTotaleEnergiaReattiva>
				<RTotaleGenerale>67,79</RTotaleGenerale>
			</RiepilogoValori>
			<RiepilogoValori>
				<RTipologiaContrattuale>Lettera b)</RTipologiaContrattuale>
				<RNumeroPod>2</RNumeroPod>
				<RTotTarDistQtFissa>1,14</RTotTarDistQtFissa>
				<RTotTarDistQtPotenza>3,77</RTotTarDistQtPotenza>
				<RTotTarDistEnAttiva>93,77</RTotTarDistEnAttiva>
				<RTotTarDistEnReattiva>0,00</RTotTarDistEnReattiva>
				<RTotOnGenUltComQtFissa>0,04</RTotOnGenUltComQtFissa>
				<RTotOnGenUltComQtPotenza>0,09</RTotOnGenUltComQtPotenza>
				<RTotOnGenUltComEnAttiva>89,41</RTotOnGenUltComEnAttiva>
				<RTotaleQuotaFissa>1,18</RTotaleQuotaFissa>
				<RTotaleQuotaPotenza>3,86</RTotaleQuotaPotenza>
				<RTotaleEnergiaAttiva>183,18</RTotaleEnergiaAttiva>
				<RTotaleEnergiaReattiva>0,00</RTotaleEnergiaReattiva>
				<RTotaleGenerale>188,77</RTotaleGenerale>
			</RiepilogoValori>
			<RiepilogoValori>
				<RTipologiaContrattuale>Lettera d)</RTipologiaContrattuale>
				<RNumeroPod>1</RNumeroPod>
				<RTotTarDistQtFissa>2,07</RTotTarDistQtFissa>
				<RTotTarDistQtPotenza>112,13</RTotTarDistQtPotenza>
				<RTotTarDistEnAttiva>13,66</RTotTarDistEnAttiva>
				<RTotTarDistEnReattiva>13,40</RTotTarDistEnReattiva>
				<RTotOnGenUltComQtFissa>11,25</RTotOnGenUltComQtFissa>
				<RTotOnGenUltComQtPotenza>0,00</RTotOnGenUltComQtPotenza>
				<RTotOnGenUltComEnAttiva>125,09</RTotOnGenUltComEnAttiva>
				<RTotaleQuotaFissa>13,32</RTotaleQuotaFissa>
				<RTotaleQuotaPotenza>112,13</RTotaleQuotaPotenza>
				<RTotaleEnergiaAttiva>138,75</RTotaleEnergiaAttiva>
				<RTotaleEnergiaReattiva>13,40</RTotaleEnergiaReattiva>
				<RTotaleGenerale>277,60</RTotaleGenerale>
			</RiepilogoValori>
			<RiepilogoIVA>
				<RAliquotaIVA>22%</RAliquotaIVA>
				<RImponibileIVA>533,61</RImponibileIVA>
				<RImportoIVA>117,39</RImportoIVA>
			</RiepilogoIVA>
			<NoteFattura>esempio</NoteFattura>
			<NoteFattura>prima fattura di ciclo</NoteFattura>
		</RiepilogoFattura>
		<DettaglioPOD>
			<DCodicePod>IT999E301</DCodicePod>
			<DatiTecniciCommerciali>
				<DDTTensione>BT</DDTTensione>
				<DDTPotenzaImpegnata>3,0</DDTPotenzaImpegnata>
				<DDTPotenzaDisponibile>3,30</DDTPotenzaDisponibile>
				<DDCTipologiaContrattuale>Lettera a)</DDCTipologiaContrattuale>
				<DDCTariffaDistribuzione>D2</DDCTariffaDistribuzione>
				<DDCProduttoriPuriPerizia>NO</DDCProduttoriPuriPerizia>
				<DDCFornituraEnergivora>NO</DDCFornituraEnergivora>
			</DatiTecniciCommerciali>
			<DatiTecniciCommerciali>
				<DDTTensione>BT</DDTTensione>
				<DDTPotenzaImpegnata>4,5</DDTPotenzaImpegnata>
				<DDTPotenzaDisponibile>5,00</DDTPotenzaDisponibile>
				<DDCTipologiaContrattuale>Lettera a)</DDCTipologiaContrattuale>
				<DDCTariffaDistribuzione>D3</DDCTariffaDistribuzione>
				<DDCProduttoriPuriPerizia>NO</DDCProduttoriPuriPerizia>
				<DDCFornituraEnergivora>NO</DDCFornituraEnergivora>
			</DatiTecniciCommerciali>
			<Corrispettivi>
				<DComponente>€/POD</DComponente>
				<DPeriodoCompetenzaDa>28/01/2016</DPeriodoCompetenzaDa>
				<DPeriodoCompetenzaA>31/01/2016</DPeriodoCompetenzaA>
				<DCorrispettivoUnitario>0,05510219</DCorrispettivoUnitario>
				<DCodiceIVA>ORD</DCodiceIVA>
				<DImporto>0,22</DImporto>
			</Corrispettivi>
			<Corrispettivi>
				<DComponente>€/kW</DComponente>
				<DPeriodoCompetenzaDa>28/01/2016</DPeriodoCompetenzaDa>
				<DPeriodoCompetenzaA>31/01/2016</DPeriodoCompetenzaA>
				<DQuantità>3,30</DQuantità>
				<DCorrispettivoUnitario>0,04496137</DCorrispettivoUnitario>
				<DCodiceIVA>ORD</DCodiceIVA>
				<DImporto>0,59</DImporto>
			</Corrispettivi>
			<Corrispettivi>
				<DComponente>€/kWh</DComponente>
				<DPeriodoCompetenzaDa>28/01/2016</DPeriodoCompetenzaDa>
				<DPeriodoCompetenzaA>31/01/2016</DPeriodoCompetenzaA>
				<DScaglione>1</DScaglione>
				<DQuantità>20,00</DQuantità>
				<DCorrispettivoUnitario>0,116222</DCorrispettivoUnitario>
				<DCodiceIVA>ORD</DCodiceIVA>
				<DImporto>2,32</DImporto>
			</Corrispettivi>
			<Corrispettivi>
				<DComponente>€/kWh</DComponente>
				<DPeriodoCompetenzaDa>28/01/2016</DPeriodoCompetenzaDa>
				<DPeriodoCompetenzaA>31/01/2016</DPeriodoCompetenzaA>
				<DScaglione>2</DScaglione>
				<DQuantità>9,00</DQuantità>
				<DCorrispettivoUnitario>0,133352</DCorrispettivoUnitario>
				<DCodiceIVA>ORD</DCodiceIVA>
				<DImporto>1,20</DImporto>
			</Corrispettivi>
			<Corrispettivi>
				<DComponente>€/kWh</DComponente>
				<DPeriodoCompetenzaDa>28/01/2016</DPeriodoCompetenzaDa>
				<DPeriodoCompetenzaA>31/01/2016</DPeriodoCompetenzaA>
				<DScaglione>3</DScaglione>
				<DQuantità>20,00</DQuantità>
				<DCorrispettivoUnitario>0,17317200</DCorrispettivoUnitario>
				<DCodiceIVA>ORD</DCodiceIVA>
				<DImporto>3,46</DImporto>
			</Corrispettivi>
			<Corrispettivi>
				<DComponente>€/kWh</DComponente>
				<DPeriodoCompetenzaDa>28/01/2016</DPeriodoCompetenzaDa>
				<DPeriodoCompetenzaA>31/01/2016</DPeriodoCompetenzaA>
				<DScaglione>4</DScaglione>
				<DQuantità>278,00</DQuantità>
				<DCorrispettivoUnitario>0,215842</DCorrispettivoUnitario>
				<DCodiceIVA>ORD</DCodiceIVA>
				<DImporto>60,00</DImporto>
			</Corrispettivi>
		</DettaglioPOD>
		<DettaglioPOD>
			<DCodicePod>IT999E302</DCodicePod>
			<DatiTecniciCommerciali>
				<DDTTensione>BT</DDTTensione>
				<DDTPotenzaImpegnata>3,00</DDTPotenzaImpegnata>
				<DDTPotenzaDisponibile>3,30</DDTPotenzaDisponibile>
				<DDCTipologiaContrattuale>Lettera b)</DDCTipologiaContrattuale>
				<DDCTariffaDistribuzione>D2</DDCTariffaDistribuzione>
				<DDCProduttoriPuriPerizia>NO</DDCProduttoriPuriPerizia>
				<DDCFornituraEnergivora>NO</DDCFornituraEnergivora>
			</DatiTecniciCommerciali>
			<Corrispettivi>
				<DComponente>€/POD</DComponente>
				<DPeriodoCompetenzaDa>01/01/2016</DPeriodoCompetenzaDa>
				<DPeriodoCompetenzaA>31/01/2016</DPeriodoCompetenzaA>
				<DCorrispettivoUnitario>0,59000000</DCorrispettivoUnitario>
				<DCodiceIVA>ORD</DCodiceIVA>
				<DImporto>0,59</DImporto>
			</Corrispettivi>
			<Corrispettivi>
				<DComponente>€/kW</DComponente>
				<DPeriodoCompetenzaDa>01/01/2016</DPeriodoCompetenzaDa>
				<DPeriodoCompetenzaA>31/01/2016</DPeriodoCompetenzaA>
				<DQuantità>3,30</DQuantità>
				<DCorrispettivoUnitario>0,58454167</DCorrispettivoUnitario>
				<DCodiceIVA>ORD</DCodiceIVA>
				<DImporto>1,93</DImporto>
			</Corrispettivi>
			<Corrispettivi>
				<DComponente>€/kWh</DComponente>
				<DPeriodoCompetenzaDa>01/01/2016</DPeriodoCompetenzaDa>
				<DPeriodoCompetenzaA>19/01/2016</DPeriodoCompetenzaA>
				<DScaglione>1</DScaglione>
				<DQuantità>94,00</DQuantità>
				<DCorrispettivoUnitario>0,04821200</DCorrispettivoUnitario>
				<DCodiceIVA>ORD</DCodiceIVA>
				<DImporto>4,53</DImporto>
			</Corrispettivi>
			<Corrispettivi>
				<DComponente>€/kWh</DComponente>
				<DPeriodoCompetenzaDa>01/01/2016</DPeriodoCompetenzaDa>
				<DPeriodoCompetenzaA>19/01/2016</DPeriodoCompetenzaA>
				<DScaglione>2</DScaglione>
				<DQuantità>44,00</DQuantità>
				<DCorrispettivoUnitario>0,10409200</DCorrispettivoUnitario>
				<DCodiceIVA>ORD</DCodiceIVA>
				<DImporto>4,58</DImporto>
			</Corrispettivi>
			<Corrispettivi>
				<DComponente>€/kWh</DComponente>
				<DPeriodoCompetenzaDa>01/01/2016</DPeriodoCompetenzaDa>
				<DPeriodoCompetenzaA>19/01/2016</DPeriodoCompetenzaA>
				<DScaglione>3</DScaglione>
				<DQuantità>36,00</DQuantità>
				<DCorrispettivoUnitario>0,16938200</DCorrispettivoUnitario>